{
	"$schema": "http://json-schema.org/draft-04/schema#",
	"title": "Example",
	"description": "An Example molecule",
	"type": "object",
	"properties": {
		"modifier": {
			"description": "A modifier",
			"type": "string"
		},
		"decorator": {
			"description": "A decorator",
			"type": "string"
		},
		"title": {
			"description": "Title of the pattern",
			"type": "string",
			"minLength": 3,
			"maxLength": 100
		},
		"links": {
			"description": "An array of links",
			"type": "array",
			"minItems": 1,
			"items": {
				"type": "object",
				"properties": {
					"uri": {
						"description": "the target uri",
						"type": "string",
						"pattern": "^[a-z]*$"
					},
					"text": {
						"description": "The link text",
						"type": "string"
					}
				}
			},
			"required": ["uri", "text"],
			"additionalProperties": false
		}
	},
	"required": ["title", "links"],
	"dependencies": {}
}
