{
	"modifier": "",
	"decorator": "",
	"title": "Example Module",
	"links": [
		{
			"uri": "index",
			"text": "Example 1"
		},
		{
			"uri": "index",
			"text": "Example 2"
		},
		{
			"uri": "index",
			"text": "Example 3"
		},
		{
			"uri": "index",
			"text": "Example 4"
		},
		{
			"uri": "index",
			"text": "Example 5"
		}
	]
}
